{
  "schema_version": "1.0",
  "product_id": "new-asset-studio",
  "name": "Asset Studio",
  "category": "desktop",
  "concept": "一款面向独立游戏团队的全新资产管理应用，集中管理贴图、模型和音频，并支持标签筛选",
  "requirements": [
    {
      "id": "REQ-001",
      "text": "一款面向独立游戏团队的全新资产管理应用，集中管理贴图、模型和音频，并支持标签筛选",
      "source": "user-prompt",
      "authority": "source-stated",
      "use_case_ids": []
    },
    {
      "id": "REQ-002",
      "text": "用户按类型和标签筛选游戏资产，选择素材查看详情",
      "source": "user-prompt",
      "authority": "source-stated",
      "use_case_ids": [
        "UC-001"
      ]
    }
  ],
  "hard_constraints": [],
  "use_cases": [
    {
      "id": "UC-001",
      "title": "用户按类型和标签筛选游戏资产，选择素材查看详情",
      "actor": "unspecified",
      "goal": "用户按类型和标签筛选游戏资产，选择素材查看详情",
      "steps": [
        {
          "id": "STEP-001",
          "action": "用户按类型和标签筛选游戏资产，选择素材查看详情",
          "state": "in-progress",
          "flow": "main",
          "ui_text": [],
          "visible_evidence": []
        }
      ]
    }
  ],
  "unknowns": [
    "actor",
    "interaction design",
    "UI layout",
    "visual style",
    "visible feedback"
  ],
  "origin": {
    "mode": "direct-prompt",
    "source_id": "CLI:brief-init"
  }
}
