{
  "schema_version": "1.0",
  "product_id": "new-hamlet-builder",
  "name": "Hamlet Builder",
  "category": "game",
  "concept": "一款原创等距视角建造经营游戏，玩家建造农场并规划居民劳动，视觉风格温暖清晰",
  "requirements": [
    {
      "id": "REQ-001",
      "text": "一款原创等距视角建造经营游戏，玩家建造农场并规划居民劳动，视觉风格温暖清晰",
      "source": "user-prompt",
      "authority": "source-stated",
      "use_case_ids": []
    },
    {
      "id": "REQ-002",
      "text": "玩家选择农场并查看产量与已分配工人",
      "source": "user-prompt",
      "authority": "source-stated",
      "use_case_ids": [
        "UC-001"
      ]
    }
  ],
  "hard_constraints": [],
  "use_cases": [
    {
      "id": "UC-001",
      "title": "玩家选择农场并查看产量与已分配工人",
      "actor": "unspecified",
      "goal": "玩家选择农场并查看产量与已分配工人",
      "steps": [
        {
          "id": "STEP-001",
          "action": "玩家在等距游戏地图中选中一座农场",
          "state": "in-progress",
          "flow": "main",
          "ui_text": [],
          "visible_evidence": [
            "等距建造游戏场景",
            "选中的农场高亮状态"
          ]
        },
        {
          "id": "STEP-002",
          "action": "玩家查看所选农场的产量和已分配工人",
          "state": "in-progress",
          "flow": "main",
          "ui_text": [
            "产量"
          ],
          "visible_evidence": [
            "农场详情面板",
            "当前产量",
            "已分配工人数量"
          ]
        },
        {
          "id": "STEP-003",
          "action": "玩家为农场分配一名工人并查看分配结果",
          "state": "success",
          "flow": "main",
          "ui_text": [
            "分配工人"
          ],
          "visible_evidence": [
            "农场仍保持选中",
            "分配后的工人状态变化"
          ]
        }
      ]
    }
  ],
  "unknowns": [
    "actor",
    "interaction design",
    "UI layout",
    "visual style",
    "visible feedback"
  ],
  "origin": {
    "mode": "curated",
    "source_id": "benchmarks/new-products/fictional-WP02"
  }
}
